,comments,created_utc,crossposts,domain,gilded,score,subreddit,title,upvote_ratio
1159,79,1527684914.0,0,i.redd.it,0,4654,me_irl,me_irl,0.98
1160,125,1527696174.0,0,self.askgaybros,0,539,askgaybros,My husband hit me,0.96
1161,14,1527705526.0,0,i.imgur.com,0,331,LGBTeens,[Picture] dank maymay,0.97
1162,532,1527683059.0,4,en.wikipedia.org,0,10483,todayilearned,"TIL a Mormon missionary in the 1850s declared himself to be the second coming of Christ and started a new religious movement. His movement ended when he attempted to ""ascend into Heaven"" by jumping off of a cliff in front of all his followers",0.95
1163,23,1527707347.0,0,i.redd.it,0,298,oklahoma,It's what the ladies like.,0.93
1164,10,1527714984.0,0,i.redd.it,0,204,kittens,An actual box of kittens came into the SPCA 😍😍😍,0.99
1165,6,1527709751.0,1,v.redd.it,0,267,wildlypenis,Intentional?,0.96
1166,15,1527676734.0,0,gfycat.com,0,1443,jilling,Girls watch porn too!,0.96
1167,18,1527683119.0,0,gfycat.com,0,1028,quiver,"Please enjoy this pussy-shaking, dripping wet orgasm for my first post here [OC]",0.95
1168,44,1527712205.0,0,i.redd.it,0,365,guns,WASR-Pup Wednesday - A Rifle for Space Romanians,0.96
1169,7,1527693917.0,0,v.redd.it,0,591,Drizzy,yikes,0.96
1170,87,1527685732.0,0,i.imgur.com,0,900,CitiesSkylines,I am cruel,0.96
1171,78,1527675187.0,0,self.TalesFromTheCustomer,1,1572,TalesFromTheCustomer,Thank goodness he forgot the straw.,0.98
1172,56,1527697837.0,0,imgur.com,0,478,detroitlions,Meanwhile in /r/aww,0.96
1173,172,1527692054.0,1,i.redd.it,0,1014,MapPorn,Comparison of Armenian populations in the Middle East in 1900 and 2000.,0.94
1174,98,1527685774.0,0,i.redd.it,0,889,sjwhate,SOLO: A Social Justice Story,0.84
1175,125,1527656125.0,0,i.redd.it,0,4911,BestOfReports,"There is no way a person would ever suggest Edge, right?",0.96
1176,27,1527715725.0,1,i.redd.it,0,191,bipolar,started my bipolar bullet journal today,0.98
1177,23,1527709097.0,0,imgur.com,0,267,LatinasGW,cum inside my tiny 100lbs mil[f] batcave(; Dildo fun,0.98
1178,154,1527697027.0,0,blog.us.playstation.com,0,500,PS4Deals,PS+ Free Games June 2018 | PSN | Available June 5th,0.96
1179,3,1527681272.0,1,i.imgur.com,0,1121,Stacked,Tessa Fowler,0.97
1180,90,1527686602.0,0,i.redd.it,0,1380,trashy,My neighbor’s front yard. Just imagine what the inside must look like.,0.97
1181,24,1527695307.0,0,bleepingcomputer.com,0,538,programming,Malicious Git Repository Can Lead to Code Execution on Remote Systems,0.94
1182,64,1527702019.0,0,i.redd.it,0,379,Warthunder,Humvee with TOW launcher for Tier 6 USA Tank Destroyer?,0.96
1183,9,1527686958.0,0,i.redd.it,0,1318,teefies,Adventure cat teefies,0.99
1184,6,1527718608.0,6,i.imgur.com,0,260,RealGirls,as perky as they come,0.97
1185,52,1527687187.0,0,i.redd.it,0,824,garlicoin,The Aftermath of 50 Cent investing in GRLC.,0.93
1186,0,1527715439.0,0,i.imgur.com,0,195,NatalieDormer,Smouldering,0.96
1187,7,1527711198.0,0,gfycat.com,0,241,whenitgoesin,Notty houswife,0.96
1188,14,1527710054.0,0,i.redd.it,0,252,wiiu,Found at my target today! So excited!,0.92
1189,5,1527703488.0,0,i.redd.it,0,356,ambien,Don't be a reptilian and take ambien is the lesson here.,0.93
1190,62,1527689091.0,0,v.redd.it,0,757,FortniteBattleRoyale,You have got to try this with shopping carts,0.96
1191,3,1527710855.0,0,i.imgur.com,0,244,Sierra_Skye,Afternoon tea,0.97
1192,104,1527700599.0,0,self.ClashRoyale,0,414,ClashRoyale,[Rant] Banning for swearing is ridiculous.,0.93
1193,6,1527699114.0,0,gfycat.com,0,444,nsfwhardcore,Doggystyle,0.98
1194,3,1527717731.0,0,i.redd.it,0,173,Nekomimi,Apple,0.97
1195,37,1527704336.0,0,i.redd.it,0,534,pathofexile,A tragedy of misplaced nodes on Trickster's tree,0.92
1196,5,1527672121.0,0,i.redd.it,0,1819,mlem,Big mlem from a small kitty,0.98
1197,13,1527681988.0,0,imgur.com,0,1062,thighdeology,That look...,0.97
1198,31,1527724283.0,0,cbc.ca,0,121,Calgary,Alberta passes bill legislating 'safe zones' around abortion clinics,0.95
1199,14,1527705019.0,0,i.redd.it,0,819,Tinder,Joint love affair,0.98
1200,11,1527708851.0,0,i.redd.it,0,273,youdontsurf,Meanwhile at Tom's wake...,0.86
1201,10,1527683703.0,0,cdna.artstation.com,0,963,ImaginaryLeviathans,The One Above by Robson Michel,0.98
1202,4,1527715888.0,0,i.imgur.com,0,189,Annoyedtobenude,“if you’re happy looking at my boobs.... that’s just fine”,0.96
1203,10,1527701646.0,0,self.WordAvalanches,0,389,WordAvalanches,Pop-Star stabs London man in the leg.,0.97
1204,20,1527680091.0,0,i.redd.it,0,1172,instantkarma,When you lose to an inanimate object,0.94
1205,2,1527699226.0,0,gfycat.com,0,436,NSFW_Japan,Anri Okita - Captured And Fucked,0.96
1206,6,1527702969.0,0,i.redd.it,0,362,dndmemes,Our rogue's reply whenever anyone casts Zone of Truth,0.97
1207,30,1527721194.0,0,i.redd.it,0,360,DotA2,guys literally only want one thing and its fucking disgusting,0.93
1208,58,1527706990.0,1,i.imgur.com,0,3074,gifs,Wonder Woman meets mini Wonder Woman.,0.95
1209,9,1527710864.0,0,i.redd.it,0,236,GoneWildTrans,"The little dudette doesn’t always get hard, but when she does...",0.95
1210,1,1527714280.0,0,cdn.awwni.me,0,203,pantsu,Black surprise [Masamune-kun no Revenge],0.99
1211,55,1527709710.0,0,i.redd.it,0,248,SiliconValleyHBO,"Dinesh mentions this fleeting anecdote. I became intrigued so I tried searching for it, yet I couldn't find any details on it anywhere. Does anyone know what's the full story here?",0.97
1212,9,1527711654.0,0,imgur.com,0,233,OldManDog,My old lady sammi recovering from surgery (14),0.99
1213,19,1527727201.0,0,streamable.com,0,110,MLS,Ilsinho [Philadelphia Union] nice goal vs Chicago Fire [1-0],0.99
1214,40,1527680320.0,0,i.imgur.com,0,1134,JessicaNigri,We're all happy it's back,0.95
1215,4,1527710199.0,0,imgur.com,0,247,GoneWildSmiles,Wearing a little pink makes me smile!,0.97
1216,11,1527713464.0,0,i.redd.it,0,333,KidsAreFuckingStupid,The King of stupid,0.99
1217,344,1527671369.0,0,i.redd.it,0,2940,TumblrInAction,Health has no correlation with weight,0.98
1218,23,1527692728.0,0,clips.twitch.tv,0,600,SovietWomble,Soviet plays Thomas the Tank Engine on Beat Saber,0.97
1219,37,1527694370.0,0,i.redd.it,0,548,PUBGMobile,This belongs here,0.96
1220,19,1527701776.0,0,i.redd.it,0,382,titanfall,3D printed alternator key chain. I created the model myself.,0.98
1221,86,1527710797.0,0,i.redd.it,0,929,StarWars,Ironic,0.96
1222,14,1527716467.0,0,i.redd.it,0,281,RWBY,Pyrrha Beating the Heat With the Beach [jesper-mojo],0.99
1223,44,1527698506.0,2,i.redd.it,0,2482,memes,Christ is watching,0.96
1224,15,1527701868.0,0,i.redd.it,0,923,LateStageCapitalism,Racism is only bad when unprofitable,0.95
1225,6,1527682749.0,0,i.imgur.com,0,994,burstingout,That body,0.96
1226,7,1527697865.0,0,i.imgur.com,0,456,MonsterGirl,"Lucy, a scary demon girl [Samanatorclub]",0.98
1227,10,1527701967.0,0,i.imgur.com,0,376,Ebony,Satisfaction,0.97
1228,24,1527721155.0,0,i.imgur.com,0,234,instant_regret,Deliberately holding up traffic in the outside lane...,0.93
1229,12,1527694630.0,1,i.redd.it,0,847,goddesses,Catherine Schultz,0.97
1230,385,1527654722.0,0,self.LifeProTips,0,15595,LifeProTips,"LPT: Don’t forget to donate food this summer! Typically, folks excessively donate in the winter to food banks before or during the holidays, which is great. But in the summer, donations are lowest, so this is when the food bank’s need is greatest.",0.91
1231,28,1527707858.0,0,i.redd.it,0,272,gaybrosgonemild,Here’s me cooking at my culinary school.,0.99
1232,4,1527693933.0,0,i.redd.it,0,558,futureporn,'Leaving 2210' by John Berkey [760x1024],0.97
1233,49,1527663543.0,0,i.redd.it,0,6307,trebuchetmemes,"A Perfect Use of The Superior Siege Weapon, Depicted by The Oatmeal.",0.94
1234,3,1527724606.0,0,i.redd.it,0,122,IRLEasterEggs,A funny plaque,0.96
1235,57,1527679028.0,0,gfycat.com,0,1215,HitBoxPorn,This hitbox saved my life,0.96
1236,31,1527698255.0,0,i.redd.it,0,445,Amd,"A stunning Ryzen BattleBot to be displayed at Computex 2018, powered by AMD Ryzen and Radeon RX Vega.",0.95
1237,56,1527698118.0,0,self.femalefashionadvice,0,451,femalefashionadvice,Absent Minded Professor- inspiration album,0.93
1238,24,1527686187.0,1,i.imgur.com,0,819,startrekgifs,"When it's your birthday, but you have to work.",0.96
1239,43,1527681217.0,0,theguardian.com,0,1060,EverythingScience,"Nasa full of 'fear and anxiety' since Trump took office, ex-employee says - Those still at the agency fear climate science funding will be cut since it is now considered a ‘sensitive subject’",0.93
1240,2,1527713445.0,0,i.redd.it,0,203,AllisonParker,Her newest Instagram post 🔥,0.97
1241,23,1527706138.0,0,i.redd.it,0,299,GreenBayPackers,That third arm will certainly help!,0.94
1242,4,1527691457.0,0,i.imgur.com,0,629,Animewallpaper,Saber Alter [Fate](1440x2560),0.96
1243,7,1527716091.0,0,gfycat.com,0,186,kpopfap,Uni.t - Woohee's Feeling it,0.96
1244,27,1527699244.0,0,i.redd.it,0,421,imaginarymaps,Artifact from a timeline where South Sudan exists but Serbia-Montenegro never dissolved and is still called Yugoslavia found in a HomeGoods,0.97
1245,65,1527689210.0,0,i.redd.it,0,712,NoMansSkyTheGame,One of the less known original box art variants,0.96
1246,15,1527692157.0,0,i.redd.it,0,604,Miniworlds,Chard forest,0.97
1247,11,1527727998.0,0,gfycat.com,0,102,NYGiants,Kyle Lauletta practicing with last year's offense,0.98
1248,19,1527682136.0,0,i.redd.it,0,1040,hiking,"My Friend During an Afternoon Hike to Arapahoe Pass, Colorado",0.99
1249,3,1527715366.0,0,i.redd.it,0,187,BokuNoEroAcademia,Momo being momo,0.98
1250,241,1527702235.0,0,i.redd.it,0,571,smashbros,A Serious Discussion we need to have about the new game,0.91
1251,29,1527693136.0,0,i.redd.it,0,571,Disneyland,Clarabelle’s new sundaes,0.98
1252,20,1527701312.0,0,i.redd.it,0,382,newjersey,"Manasquan Inlet, New Jersey [4275x2850]",0.98
1253,2,1527699174.0,0,i.redd.it,0,420,OffensiveMemes,It never do be like that,0.96
1254,35,1527681334.0,0,i.redd.it,0,1647,comicbooks,The back cover of No Justice #4 hit me hard.,0.95
1255,9,1527715324.0,0,i.redd.it,0,289,splatoon,When a Weapon with the Autobomb Launcher is Released,0.97
1256,60,1527698989.0,0,i.redd.it,0,1040,LiverpoolFC,Go on Ox son,0.97
1257,139,1527687451.0,0,self.keto,0,1205,keto,6 MONTH UPDATE -- Down 88.4 lbs,0.95
1258,2,1527712774.0,0,i.imgur.com,0,206,B_Cups,Irresistible blonde beauty,0.97
1259,38,1527698884.0,0,twitter.com,0,667,esist,Who is the real victim of Roseanne Barr's racist speech? Look at how Trump decides to whine and make it all about him. Tiresome racist loser.,0.94
1260,118,1527663961.0,0,i.redd.it,0,2655,MilitaryPorn,"British Army Combat Medic Chantelle Taylor. Renowned for being the first British female soldier in history to engage and kill an enemy combatant at close quarters, she was the lead medic supporting an infantry fighting company in Helmand Province, Afghanistan. [2160×2169]",0.95
1261,20,1527708464.0,0,i.imgur.com,0,408,MadeMeSmile,8-year-old boy asked his mom to stop the car so he could help a woman up the stairs,0.96
1262,115,1527676916.0,0,i.redd.it,0,1324,analog,I've been scanning Kodachrome and now I'm sad (This was taken in the Greek islands around the 1960s) [Unknown Camera/lens],0.98
1263,6,1527709432.0,0,photos.smugmug.com,0,252,ArchitecturePorn,"Spiral staircase located along the Embarcadero in San Francisco, California [1280 x 854]",0.98
1264,66,1527720916.0,0,i.redd.it,0,1403,BlackPeopleTwitter,Get your reading level up,0.98
1265,26,1527699139.0,0,imgur.com,0,419,showerbeer,"My fave cocktail, in beer form",0.96
1266,5,1527691449.0,0,i.redd.it,0,613,AsianCuties,Mari Bambei (high res)(@1bambei),0.97
1267,4,1527724461.0,0,78.media.tumblr.com,0,120,HelloInternet,"Most US state flags are bad, but not Maryland's",0.94
1268,846,1527654870.0,0,i.redd.it,0,14217,iamverysmart,Actually,0.94
1269,189,1527677056.0,2,i.redd.it,0,4220,MemeEconomy,Possible investment,0.96
1270,414,1527706899.0,0,youtube.com,0,275,MagicArena,MTG Arena Developer Update: Standard & Best-of-Three,0.95
1271,18,1527716707.0,0,self.shortscarystories,0,171,shortscarystories,Is there a god?,0.9
1272,12,1527707276.0,0,i.redd.it,0,428,shittyrainbow6,Beautiful art from u/seriousSeb,0.98
1273,14,1527721206.0,0,gfycat.com,0,348,Unexpected,“Let's see who will win”?,0.9
1274,97,1527672264.0,5,i.redd.it,0,1656,thenetherlands,Alle fietspaden in Nederland/All Bicycle paths in The Netherlands (april 2018),0.97
1275,45,1527686628.0,1,toshitimes.com,0,786,ethereum,Chinese President Publicly Endorses Blockchain As Leading ”Technology Revolution”,0.96
1276,16,1527718288.0,0,i.redd.it,0,158,Denver,Mt. Evans Sunset 5-29-18. Just a friendly reminder that the Mount Evans Scenic Byway is now open. A wonderful way to get up and experience the Colorado alpine so close to Denver. Always enjoy sharing the natural beauty of our area. Get out and enjoy it!,0.94
1277,202,1527675972.0,0,i.redd.it,0,1352,EnoughTrumpSpam,Holy fuck.,0.97
1278,152,1527656743.0,2,media.giphy.com,0,8775,AnimalsBeingJerks,This is MY gutter!,0.96
1279,177,1527693491.0,1,blockmanity.com,0,883,CryptoCurrency,"Chinese President Bullish on Blockchain calls it a ""Breakthrough"" Technology",0.94
1280,5,1527699222.0,1,i.redd.it,0,659,teenagers,Every time,0.98
1281,1,1527716511.0,0,i.redd.it,0,169,geekygirls,Erica Fett,0.95
1282,26,1527715565.0,0,v.redd.it,0,1166,oddlysatisfying,This interaction between Bus Driver and Motorcyclist,0.98
1283,6,1527714823.0,0,i.redd.it,0,182,GoneErotic,[F]irst time posting here 🖤,0.99
1284,136,1527676814.0,0,telegram.org,0,1286,apple,"Remember Russia asking Apple to remove telegram from App Store? Apparently, Apple has been blocking updates for it globally since mid-april",0.94
1285,5,1527701036.0,0,gfycat.com,0,372,StraightGirlsPlaying,Sneaky bf[f],0.82
1286,206,1527678326.0,0,androidauthority.com,0,1872,Android,Android P update coming to all of HMD Global's Nokia smartphones released so far,0.95
1287,34,1527699882.0,0,i.imgur.com,0,389,armoredwomen,"[The Expanse] Mars Congressional Republic Navy Gunnery Sergeant Bobbie Draper, in Goliath Mark IV power armor",0.96
1288,30,1527701873.0,0,i.redd.it,0,357,arcticmonkeys,When you finally realize that Batphone is actually great...,0.96
1289,11,1527725139.0,0,i.imgur.com,0,123,blackmagicfuckery,"Oh, just my little chair",0.96
1290,8,1527693312.0,0,gfycat.com,0,863,PartyParrot,Doin a swing,0.99
1291,1,1527722077.0,0,i.redd.it,0,129,EmiliaClarke,Black Dress,0.97
1292,14,1527701787.0,0,i.imgur.com,0,357,DesirePath,"My front yard. I can't blame people; unless you're in the driveway, it's fairly inconvenient to stay off the grass. After recently discovering this sub, I convinced my wife we should put a walkway there soon.",0.99
1293,4,1527708051.0,1,i.redd.it,0,640,hmmm,hmmm,0.98
1294,38,1527693114.0,0,i.redd.it,0,562,LabiaGW,Rate pls :3,0.99
1295,15,1527693168.0,0,self.circlejerk,0,565,circlejerk,Fallout 76. 7+6=13. 13 Reasons Why. Fallout 76 is going to be a school shooting simulation.,0.98
1296,17,1527683550.0,0,i.imgur.com,0,900,GoneMild,I love the colors against my pale skin [f] 😊😘,0.98
1297,6,1527719643.0,0,imgur.com,0,149,gwcumsluts,Break[f]ast on the balcony,0.98
1298,330,1527691193.0,0,i.redd.it,0,961,Libertarian,Classic California,0.88
1299,26,1527722458.0,0,i.redd.it,0,127,DenverBroncos,Name a more iconic duo. I’ll wait...,0.99
1300,19,1527716707.0,0,self.shortscarystories,0,176,shortscarystories,Is there a god?,0.9
1301,38,1527698884.0,0,twitter.com,0,669,esist,Who is the real victim of Roseanne Barr's racist speech? Look at how Trump decides to whine and make it all about him. Tiresome racist loser.,0.95
1302,20,1527708464.0,0,i.imgur.com,0,412,MadeMeSmile,8-year-old boy asked his mom to stop the car so he could help a woman up the stairs,0.96
1303,1,1527722077.0,0,i.redd.it,0,131,EmiliaClarke,Black Dress,0.97
1304,115,1527676916.0,0,i.redd.it,0,1318,analog,I've been scanning Kodachrome and now I'm sad (This was taken in the Greek islands around the 1960s) [Unknown Camera/lens],0.98
1305,118,1527663961.0,0,i.redd.it,0,2659,MilitaryPorn,"British Army Combat Medic Chantelle Taylor. Renowned for being the first British female soldier in history to engage and kill an enemy combatant at close quarters, she was the lead medic supporting an infantry fighting company in Helmand Province, Afghanistan. [2160×2169]",0.95
1306,2,1527712774.0,0,i.imgur.com,0,211,B_Cups,Irresistible blonde beauty,0.97
1307,35,1527681334.0,0,i.redd.it,0,1654,comicbooks,The back cover of No Justice #4 hit me hard.,0.95
1308,15,1527693168.0,0,self.circlejerk,0,563,circlejerk,Fallout 76. 7+6=13. 13 Reasons Why. Fallout 76 is going to be a school shooting simulation.,0.98
1309,139,1527687451.0,0,self.keto,0,1210,keto,6 MONTH UPDATE -- Down 88.4 lbs,0.95
1310,43,1527721421.0,0,kicker.de,0,334,LiverpoolFC,Jürgen Klopp has been voted as the best manager in the world in a survey completed by 248 Bundesliga players.,0.99
1311,26,1527699139.0,0,imgur.com,0,412,showerbeer,"My fave cocktail, in beer form",0.96
1312,5,1527691449.0,0,i.redd.it,0,618,AsianCuties,Mari Bambei (high res)(@1bambei),0.97
1313,415,1527706899.0,0,youtube.com,0,279,MagicArena,MTG Arena Developer Update: Standard & Best-of-Three,0.95
1314,12,1527707276.0,0,i.redd.it,0,428,shittyrainbow6,Beautiful art from u/seriousSeb,0.98
1315,38,1527693114.0,0,i.redd.it,0,555,LabiaGW,Rate pls :3,0.99
1316,1,1527716511.0,0,i.redd.it,0,169,geekygirls,Erica Fett,0.95
1317,846,1527654870.0,0,i.redd.it,0,14220,iamverysmart,Actually,0.94
1318,6,1527714823.0,0,i.redd.it,0,184,GoneErotic,[F]irst time posting here 🖤,0.99
1319,5,1527699222.0,1,i.redd.it,0,666,teenagers,Every time,0.98
1320,5,1527701036.0,0,gfycat.com,0,373,StraightGirlsPlaying,Sneaky bf[f],0.81
1321,45,1527686628.0,1,toshitimes.com,0,787,ethereum,Chinese President Publicly Endorses Blockchain As Leading ”Technology Revolution”,0.96
1322,97,1527672264.0,5,i.redd.it,0,1651,thenetherlands,Alle fietspaden in Nederland/All Bicycle paths in The Netherlands (april 2018),0.97
1323,3,1527725142.0,0,cdnb.artstation.com,0,113,ImaginaryTechnology,Hussar by Saby Menyhe,0.97
1324,202,1527675972.0,0,i.redd.it,0,1349,EnoughTrumpSpam,Holy fuck.,0.97
1325,189,1527677056.0,2,i.redd.it,0,4223,MemeEconomy,Possible investment,0.96
1326,51,1527718659.0,0,i.imgur.com,0,609,interestingasfuck,How aerial marker balls are installed,0.97
1327,137,1527676814.0,0,telegram.org,0,1283,apple,"Remember Russia asking Apple to remove telegram from App Store? Apparently, Apple has been blocking updates for it globally since mid-april",0.94
1328,17,1527727378.0,0,self.holdmynukacola,0,97,holdmynukacola,Upvote if your here from that comment you clicked on,0.76
1329,30,1527701873.0,0,i.redd.it,0,357,arcticmonkeys,When you finally realize that Batphone is actually great...,0.96
1330,177,1527693491.0,1,blockmanity.com,0,887,CryptoCurrency,"Chinese President Bullish on Blockchain calls it a ""Breakthrough"" Technology",0.94
1331,14,1527701787.0,0,i.imgur.com,0,356,DesirePath,"My front yard. I can't blame people; unless you're in the driveway, it's fairly inconvenient to stay off the grass. After recently discovering this sub, I convinced my wife we should put a walkway there soon.",0.99
1332,11,1527725578.0,0,i.imgur.com,0,106,slaythespire,The boot gets the boot,0.95
1333,152,1527656743.0,2,media.giphy.com,0,8776,AnimalsBeingJerks,This is MY gutter!,0.96
1334,12,1527698001.0,0,i.redd.it,0,426,UnexpectedMulaney,I don't even know what I'd be like drunk at 8 years old...,0.98
1335,34,1527699882.0,0,i.imgur.com,0,395,armoredwomen,"[The Expanse] Mars Congressional Republic Navy Gunnery Sergeant Bobbie Draper, in Goliath Mark IV power armor",0.96
1336,17,1527683550.0,0,i.imgur.com,0,901,GoneMild,I love the colors against my pale skin [f] 😊😘,0.98
1337,24,1527706391.0,0,i.redd.it,0,283,danganronpa,Happy bday to the best girl in the entire franchise!,0.99
1338,206,1527678326.0,0,androidauthority.com,0,1879,Android,Android P update coming to all of HMD Global's Nokia smartphones released so far,0.95
1339,8,1527693312.0,0,gfycat.com,0,864,PartyParrot,Doin a swing,0.99
1340,19,1527714401.0,0,i.redd.it,0,186,DestinyFashion,Guard of Rasputin,0.96
1341,7,1527694462.0,0,i.redd.it,0,512,randomsexiness,Yacht paradise,0.96
1342,4,1527708051.0,1,i.redd.it,0,642,hmmm,hmmm,0.98
1343,319,1527667373.0,0,self.changemyview,0,2132,changemyview,"CMV: The biggest motivator of school shootings, is that the media gives the perpetrator the attention they want. If nobody knew who the shooter was, there would be less incentive to commit these acts.",0.88
1344,331,1527691193.0,0,i.redd.it,0,962,Libertarian,Classic California,0.88
1345,8,1527696401.0,0,i.redd.it,0,744,SequelMemes,Wooooo!!!,0.96
1346,12,1527696082.0,0,i.redd.it,0,464,unixporn,[twmn] Hidden sound and brightness indicators,0.98
1347,15,1527686859.0,0,i.redd.it,0,759,ArtPorn,"The Princess Who Never Smiled, Viktor Vasnetsov, between 1916 and 1926 [1916 × 2720]",0.98
1348,21,1527692207.0,0,i.redd.it,0,897,ImGoingToHellForThis,Indian pussy destroyer,0.95
1349,429,1527701349.0,0,i.redd.it,0,572,Battlefield,Wow. 2 factions at launch.,0.88
1350,20,1527702877.0,2,i.imgur.com,0,326,HumansAreMetal,"In Africa's Zakouma National Park, armed rangers patrol mounted on stallions to protect the park wildlife against poachers.",0.98
1351,86,1527680719.0,0,i.redd.it,0,1740,facepalm,Journalist prints damaging story about the wrong YouTuber. [Xpost from r/pewdiepiesubmissions],0.96
1352,5,1527722456.0,0,slashfilm.com,0,123,Grimdank,"Finally, something the Thousand Sons and Space Wolves can both agree on",0.98
1353,70,1527682998.0,0,i.redd.it,0,931,eu4,I was really bored in biology.,0.96
1354,52,1527657670.0,2,i.imgur.com,0,4428,yesyesyesno,That's a very nice van you have there...,0.95
1355,10,1527711162.0,0,gfycat.com,0,221,boltedontits,Cherubesque,0.95
1356,1,1527714629.0,0,i.redd.it,0,179,characterdrawing,[OC] Way of the 4 Elements Monk,0.98
1357,25,1527698878.0,0,i.imgur.com,0,651,ATBGE,This T-Rex made out of handbags,0.94
1358,4,1527714583.0,0,i.redd.it,0,181,GalGadot,Autographs,0.99
1359,24,1527694604.0,0,i.redd.it,0,1284,MovieDetails,"In National Lampoons Vacation, Clark helps Ellen with the dishes, but he never actually washes them or puts them in the dishwasher. Instead, he wipes them off and puts them back in the cabinets.",0.97
1360,5,1527682968.0,0,i.imgur.com,0,916,TessaFowler,I love it when she raises her arms.,0.97
1361,1,1527726847.0,0,i.redd.it,0,103,alternativeart,Daddy’s Ghoul (The Addams Family) by Abigail Larson,0.95
1362,3,1527705364.0,1,i.redd.it,0,286,TheCatTrapIsWorking,Jinx is sad that the trap does not contain the listed bait.,0.97
1363,5,1527712103.0,0,i.redd.it,0,204,MonsterMusume,Cute Snek,0.99
1364,16,1527688938.0,0,i.redd.it,0,1054,fireemblem,Micaiah Cosplay by KittyKarlson,0.96
1365,36,1527705532.0,0,i.redd.it,0,454,Gunners,I love Bellerin’s sense of humor,0.94
1366,5,1527719654.0,0,i.redd.it,0,144,BigBoobsGW,They're a bit of a handful,1.0
1367,9,1527691622.0,0,gfycat.com,0,586,RemyLaCroix,Remy Lacroix gangbanged in her leg warmers...,0.96
1368,65,1527700632.0,0,i.redd.it,0,363,chemistry,"Yeah I'm totally paying $4000/g for this ""chiral"" compound",0.98
1369,6,1527704634.0,0,i.redd.it,0,298,BigBoobsGonewild,Did someone say hump day?,0.98
1370,9,1527721860.0,0,self.NBASpurs,0,122,NBASpurs,"Congratulations LaMarcus! As part of The NBPA Players’ Voice Awards, one recipient was chosen from all 30 teams as the Teammate of the Year (Backbone Award). Voted on by their teammates as someone who represents the heart and soul of their team.",0.99
1371,414,1527661580.0,0,i.redd.it,0,25341,Art,"Untitled, pen and paper, 8x10",0.9
1372,50,1527705160.0,1,i.redd.it,0,2146,dankmemes,Incognito Mode,0.96
1373,27,1527679068.0,2,i.redd.it,0,2983,EarthPorn,"Had to stitch 20+ images to capture this full aurora display over Uttakleiv Beach, Norway (OC)[1920x1246]",0.98
1374,13,1527685831.0,0,gfycat.com,0,781,deepthroat,I swear I didn't loop that!,0.98
1375,2,1527718426.0,0,i.imgur.com,0,148,xsmallgirls,this amazing profile tho,0.94
1376,10,1527716258.0,0,i.imgur.com,0,413,Eyebleach,If you're happy and you know it tap your toes.,0.96
1377,64,1527697010.0,0,i.redd.it,0,697,Guildwars2,I'm just getting into Gw2 but I can already feel the addiction growing,0.87
1378,3,1527694063.0,0,scotsman.com,0,510,Feminism,"In a world first, Scotland to roll out free sanitary products for low-income women",0.97
1379,4,1527716666.0,0,i.imgur.com,0,166,Upskirt,well hello there :3 [oc],0.97
1380,8,1527702814.0,0,i.imgur.com,0,328,feet,What do you mean it won't fit?,0.95
1381,17,1527698102.0,0,i.redd.it,0,414,Embroidery,Lunar pattern made for a friend. First time on dark fabric!,0.97
1382,31,1527699791.0,0,i.redd.it,0,593,brasil,Agora vai,0.95
1383,72,1527686456.0,1,i.redd.it,0,772,Philippines,Wala ka ng pera pero dapat feeling class pa din,0.98
1384,11,1527714981.0,0,i.redd.it,0,278,DnD,[ART] Way of the 4 Elements Monk,0.96
1385,12,1527706472.0,0,media.giphy.com,0,267,Corridor,Made The PUBG Punchline a Gif for Everyone's Future Political Sh*tposting,0.97
1386,19,1527688630.0,0,i.redd.it,0,673,castles,"Gravensteen Castle, Ghent, Belgium [1920x1080]",0.98
1387,1,1527707415.0,0,gfycat.com,0,255,PornStarHQ,Melissa Lynn – Showering milf gets fucked,0.97
1388,17,1527680385.0,0,i.redd.it,0,1781,HistoryMemes,I say we take it,0.97
1389,51,1527708626.0,0,i.redd.it,0,379,antiMLM,"Not my problem, Ashley.",0.99
1390,10,1527720635.0,0,twitter.com,0,129,torontoraptors,Kyle Lowry voted Raptors Teammate of the Year for the Third Straight Year,0.97
1391,5,1527718214.0,0,i.imgur.com,0,151,WomenOfColor,Too big for her outfit.,0.94
1392,9,1527709189.0,0,i.imgur.com,0,378,Minecraft,Cave with 3D models and Shaders in my Adventure Map,0.98
1393,98,1527690603.0,0,i.imgflip.com,0,598,headphones,This sub as of late,0.93
1394,4,1527711367.0,0,i.redd.it,0,210,TaylorSwiftsLegs,Undressing,0.97
1395,12,1527709731.0,0,i.redd.it,0,228,bjj,3/10 audio 10/10 notes,0.93
