,comments,created_utc,crossposts,domain,gilded,score,subreddit,title,upvote_ratio
448,30,1527676436.0,0,i.redd.it,0,5800,lotrmemes,My dear Gandalf!,0.93
449,105,1527673994.0,1,i.imgur.com,0,5792,AsiansGoneWild,I'll suck more than just your soul 😈,0.93
450,37,1527699301.0,0,i.redd.it,0,2205,therewasanattempt,to scam someone,0.97
451,89,1527698422.0,0,i.redd.it,0,4330,WhitePeopleTwitter,Many people should realize this.,0.98
452,320,1527669005.0,3,i.imgur.com,0,10499,whitepeoplegifs,Evangeline Lilly's ear fetish,0.93
453,140,1527674882.0,1,v.redd.it,0,6682,powerwashingporn,Using compressed air to clean my shoes after work at a golf course [OC],0.96
454,185,1527691474.0,1,i.redd.it,0,1999,Shitty_Car_Mods,Just wow!,0.91
455,28,1527701208.0,0,i.redd.it,0,1214,Perfectfit,This drawer at my new apartment that was seemingly made for Ziploc Boxes,0.99
456,827,1527678944.0,0,i.redd.it,0,9547,pcmasterrace,Pubg vs Fortnite,0.93
457,103,1527701361.0,0,self.totalwar,1,1170,totalwar,"TWW2: ""Resurgent"" Patch Notes: What They Actually Mean",0.94
458,21,1527704653.0,1,i.redd.it,0,1624,Art,"Cloudberry Dragon, GaudiBuendia, digital, 2016",0.97
459,151,1527694919.0,1,self.FortNiteBR,0,6338,FortNiteBR,Suicides in shopping carts should read...”Player461 needs a cleanup in aisle 3”,0.96
460,712,1527665395.0,0,i.redd.it,0,24762,Tinder,Classic tinder dynamics,0.95
461,4738,1527682703.0,3,scotsman.com,0,60100,worldnews,"In a world first, Scotland to roll out free sanitary products for low-income women",0.86
462,27,1527708233.0,0,i.redd.it,0,835,southpark,Canadian baby's,0.93
463,14,1527702986.0,1,i.imgur.com,0,1070,CuteLittleButts,Girls,0.94
464,28,1527678478.0,0,i.redd.it,0,4423,MEOW_IRL,meow_irl,0.97
465,22,1527716090.0,0,gfycat.com,0,556,ass,[OC] The most important meal of the day 😏,0.96
466,55,1527713094.0,0,self.ChoosingBeggars,0,645,ChoosingBeggars,"""I'll require a top-of-the-line MacBook.""",0.98
467,49,1527694520.0,0,i.imgur.com,0,1638,TheWayWeWere,Walking the Strip in Las Vegas (1960s),0.96
468,24,1527682682.0,1,i.redd.it,0,3312,calvinandhobbes,Poof,0.97
469,14,1527704234.0,0,imgur.com,0,996,ilikthebred,Teri was a clever girl! [RIP],0.97
470,29,1527677028.0,0,gfycat.com,0,4827,shittyreactiongifs,MRW I'm the director of the two girls one cup video,0.95
471,30,1527712202.0,0,i.imgur.com,0,670,vegan,Going Vegan Never Gets Boring,0.96
472,64,1527715905.0,0,self.onguardforthee,0,540,onguardforthee,"/r/Canada is so loaded with highly-upvoted insane racism, misogyny, etc. that /r/ShitRedditSays has classified it a “Low-Hanging Fruit” subreddit, auto-removing all submissions",0.91
473,51,1527696837.0,3,i.redd.it,0,1477,tf2,"SOVIET RED ARMY BEGINS TO MARCH INTO BERLIN (APRIL 16, 1945, RECOLORIZED)",0.97
474,23,1527690125.0,0,i.imgur.com,0,2065,thegrandtour,Chump Productions Ltd,0.95
475,24,1527710304.0,0,i.redd.it,0,721,IncelTears,When I hear see an incel defend one of his buddies that said something awful,0.96
476,27,1527713664.0,0,i.redd.it,0,600,FinalFantasy,"Lightning by ""Maou Sama""",0.94
477,35,1527689992.0,0,i.redd.it,0,2149,sbubby,Goodbye,0.97
478,31,1527692667.0,0,i.redd.it,0,3310,2meirl4meirl,2meirl4meirl,0.97
479,32,1527711272.0,0,i.imgur.com,0,2796,gifs,Cat and magic trick,0.96
480,71,1527687956.0,0,i.redd.it,0,2425,iamverysmart,“so tediously odious”,0.97
481,151,1527696284.0,0,i.imgur.com,0,2488,AdviceAnimals,"I didn't think this needs to be said in 2018, almost saw three accidents happen on the highway because of this over this last weekend.",0.9
482,19,1527718363.0,0,i.imgur.com,0,472,awwwtf,So majestic.,0.96
483,45,1527696605.0,2,i.redd.it,0,2533,Bossfight,"FitBull, the food demander",0.96
484,23,1527685408.0,0,v.redd.it,0,2694,holdmycatnip,"HMCN while I kitty paddle, on my back, on the carpet.",0.96
485,14,1527725012.0,0,v.redd.it,0,343,SlyGifs,Best I’ve seen in a while,0.96
486,241,1527684408.0,0,self.Twitch,0,2791,Twitch,"If ""Unattended content like sleeping on stream"" isn't allowed in IRL, then Bethesda should not be able to get away with ""Please stand by"" for 10+ hours. IMO.",0.87
487,36,1527710908.0,0,i.redd.it,0,1092,Kanye,"""Haha no dude, Drake won the beef for SURE man!""",0.97
488,49,1527698037.0,1,i.redd.it,0,1313,Meditation,Sit in a comfortable position. Feel the weight of the air around you. Feel the surface of your own skin. Now imagine that a magical eraser is erasing the outline of your being until there is no boundary between you and the rest of the Universe. Om.,0.96
489,145,1527689753.0,0,imgur.com,0,2107,ElderScrolls,This is what I wish upon Todd for not announcing TES 6,0.94
490,45,1527683794.0,0,i.redd.it,0,3101,forbiddensnacks,Forbidden Cookies And Cream,0.97
491,16,1527691443.0,0,gfycat.com,0,1861,Celebs,Jessica Alba,0.94
492,46,1527678288.0,2,gfycat.com,0,4060,TittyDrop,Exhibitionism is an important part of a complete breakfast 😊 [OC],0.95
493,122,1527698815.0,0,self.povertyfinance,0,1263,povertyfinance,I turned down a job that would have started at $17 an hour,0.96
494,15,1527721101.0,0,i.imgur.com,0,412,FitAndNatural,Competitive powerlifter Jessica Buettner at 169lbs (76.7kg) bodyweight,0.95
495,116,1527700017.0,0,en.wikipedia.org,0,5214,todayilearned,"TIL Blueberries and raspberries have the same pigment compounds, anthocyanins. Blueberries are blue because they are less acidic. If you add an acid like vinegar to crushed blueberries, they will turn red. Adding a base like baking soda will return them to blue.",0.97
496,85,1527692017.0,0,twitter.com,0,2845,atheism,"Ireland's Education Minister: ""It is not fair that parents... should feel pressure to baptize their children in order to gain admission to their local school. That is why I am proposing to remove the role that religion plays in school admissions in virtually all primary schools""",0.98
497,78,1527701162.0,0,i.redd.it,0,1104,grandorder,Made it through the event!,0.98
498,12,1527694899.0,0,i.redd.it,0,1558,Overwatch_Memes,Jeff has his priorities,0.96
499,537,1527696002.0,0,self.nba,0,6817,nba,All Philadelphia flairs have been changed to Bryan Colangelo burner account flairs,0.96
500,18,1527710639.0,0,gfycat.com,0,668,Thicker,Rosee Divine,0.97
501,42,1527694824.0,0,i.redd.it,0,1523,RWBY,Weiss Lets Her Hair Down [@mistEcru],0.98
502,57,1527677719.0,0,i.redd.it,0,4772,SequelMemes,When you are asked what type of puzzles you can solve.,0.9
503,40,1527709319.0,0,v.redd.it,0,715,camping,Waking up to bisons at Yellowstone,0.96
504,26,1527697506.0,0,gfycat.com,0,1322,HadToHurt,Ding!,0.91
505,122,1527668371.0,3,i.redd.it,0,10000,ANormalDayInRussia,Ivan riding to work,0.95
506,146,1527680188.0,2,gfycat.com,0,3353,WatchItForThePlot,Sasha Grey on Entourage,0.94
507,10,1527694676.0,0,i.imgur.com,0,1501,suicidegirls,Ellie,0.97
508,10,1527707355.0,0,i.redd.it,0,783,StuffOnCats,"Why human, why?",0.97
509,174,1527697066.0,0,i.imgur.com,0,1340,StardewValley,hi,0.91
510,81,1527707749.0,0,i.redd.it,0,1209,NintendoSwitch,These are the obvious mascots they should have chosen for Pokemon Let's Go!,0.95
511,44,1527680506.0,0,gfycat.com,0,3230,gettingherselfoff,Mom jeans,0.95
512,82,1527680414.0,0,i.redd.it,0,3786,AccidentalRacism,Gotta keep em somewhere I guess...,0.94
513,29,1527715611.0,0,i.imgur.com,0,506,sixers,A reminder of what happened the last time an ousted Philly GM was reinstated to his rightful role,0.97
514,16,1527712652.0,0,i.redd.it,0,590,PixelArt,[OC] Pulsefire Shen (Not sure about that bug),0.97
515,72,1527689473.0,0,i.redd.it,0,3271,2007scape,F,0.97
516,626,1527679095.0,0,self.OutOfTheLoop,0,3664,OutOfTheLoop,What is the conflict between Drake and Pusha T about?,0.88
517,81,1527708330.0,0,i.redd.it,0,1204,Rainbow6,Look what I got in my Alpha Pack!,0.95
518,128,1527696856.0,0,i.imgur.com,0,1321,bodybuilding,Looking absolutely AARP'd,0.96
519,493,1527688791.0,0,youtube.com,0,2040,BethesdaSoftworks,Fallout 76 – Official Teaser Trailer,0.89
520,513,1527685176.0,2,mormonleaks.io,0,2454,exmormon,"MormonLeaks has uncovered 13 LLC's (limited liability company) that appear to be owned by the Mormon Church. Combined, the companies are worth over 32 BILLION dollars. That's right, the church has 32 BILLION dollars in the stock market. The Lord sure needs a LOT of investments!",0.97
521,18,1527712670.0,0,gfycat.com,0,565,MilitaryGfys,T-55 self-entrenchment,0.97
522,78,1527704347.0,2,v.redd.it,0,1420,Whatcouldgowrong,WCGW if I flex too hard?,0.94
523,31,1527708055.0,0,change.org,0,718,Political_Revolution,A petition for the resignation of Tom Parez from DNC chair in light of his blatant disregard for the DNC charter.,0.92
524,1,1527718626.0,0,i.imgur.com,0,428,Amateur,as perky as they come,0.97
525,5,1527711526.0,0,i.redd.it,0,610,gentlemanboners,Emilia Clarke.,0.96
526,26,1527698268.0,0,i.redd.it,0,1180,sewing,I found this fabric at Goodwill (1.5 yards for $2) and it wasn't until I was sewing these bows that I discovered they GLOW IN THE DARK! Best thrift store find of the year!,0.97
527,184,1527682713.0,2,i.redd.it,0,2806,EngineeringPorn,Over 60 B-52s rest forever at Davis-Monthan Air Force base,0.96
528,105,1527683487.0,0,i.redd.it,0,4669,freefolk,A moment of silence for the one person that would’ve played any golden haired knight perfectly.,0.97
529,55,1527720292.0,0,i.redd.it,0,396,comicbooks,Purchased my very first comic book today at the age of 27. Not sure it was a great issue but I'm excited to begin this journey,0.92
530,24,1527699897.0,0,i.redd.it,0,1094,curledfeetsies,"Romulus loves chasing people walking, his sushi toy, and curling his feet during his naps.",0.99
531,21,1527697477.0,0,i.imgur.com,0,1259,shittyrainbow6,"do it, you won't",0.98
532,219,1527696896.0,0,globalnews.ca,0,1266,canada,"EXCLUSIVE: Liberals ignored green energy advice that could’ve saved Ontarians billions, lead engineer says",0.9
533,280,1527689025.0,1,i.imgur.com,0,1928,UrbanHell,"The fires are dead bodies burning. Varanasi, India",0.95
534,27,1527699408.0,0,gfycat.com,0,1091,porninfifteenseconds,Monique Alexander - Sucks cock on a boat,0.94
535,5,1527718887.0,0,i.redd.it,0,419,teefies,Bottom teefies,0.99
536,106,1527703924.0,1,i.redd.it,0,864,iamatotalpieceofshit,This white guy ran over and killed a black guy on his birthday and laughed about it,0.95
537,38,1527680279.0,1,i.imgur.com,0,3065,cosplaygirls,Total Drama Island Gwen by Jenna Lynn Meowri,0.96
538,14,1527723488.0,0,imgur.com,0,326,curvy,She’s a WOMAN (it’s me),0.94
539,123,1527679331.0,0,i.redd.it,0,3593,ofcoursethatsathing,Monster truck wedding.,0.95
540,77,1527684298.0,0,i.redd.it,0,2522,CatsStandingUp,Cat.,0.98
541,14,1527707466.0,0,i.redd.it,0,718,LadyBoners,"Chris Evans with his dog, Dodger.",0.98
542,221,1527679005.0,1,i.imgur.com,0,3647,Justfuckmyshitup,Gimme that bleached white trash roadkill,0.85
543,304,1527679329.0,0,i.redd.it,0,7234,food,[i ate] Salt Beef Bagel with Pickles and Mustard,0.9
544,33,1527712507.0,0,clips.twitch.tv,0,866,LivestreamFail,Drawing a penis in Agony completes a puzzle,0.94
545,29,1527715313.0,0,bbc.co.uk,0,482,rage,"Japanese hunters catch and kill 122 pregnant minke whales as part of its Antarctic summer ""field survey”",0.94
546,52,1527694212.0,0,i.redd.it,0,1398,gay_irl,Gay_Irl,0.96
547,461,1527689028.0,0,youtube.com,0,1850,fo4,Fallout 76 Teaser Trailer,0.96
548,43,1527721117.0,0,v.redd.it,0,362,Physics,My most recent toy,0.95
549,67,1527701323.0,0,i.redd.it,0,982,OnePiece,My Arlong Cosplay (IG: @voltageistcosplay),0.93
550,45,1527723349.0,0,i.redd.it,0,1284,BlackPeopleTwitter,How they should've fixed Roseanne,0.96
551,35,1527711499.0,0,i.redd.it,0,576,Fishing,Two for one special,0.97
552,93,1527677782.0,0,i.redd.it,0,12100,surrealmemes,"Catch it, befºre it gets too awªy.",0.88
553,45,1527680795.0,1,i.redd.it,0,2990,itookapicture,ITAP of the Munich city-center from the air,0.97
554,73,1527706386.0,0,i.redd.it,0,1202,starterpacks,“Pays for porn” starter pack,0.97
555,16,1527691758.0,0,gfycat.com,0,1573,foxes,Don't scratch the glass!,0.98
556,26,1527699565.0,0,i.imgur.com,0,1673,rickandmorty,My buddy got me this as a belated birthday gift,0.97
557,268,1527676874.0,0,i.imgur.com,0,4252,OopsDidntMeanTo,"""I swear, the sleeping pills made me do it!""",0.94
558,1019,1527686926.0,0,self.loseit,0,2024,loseit,Petty reasons to LoseIt™️?,0.95
559,12,1527709394.0,0,i.imgur.com,0,636,babyelephantgifs,Baby Elephant Chester Zoo,0.98
560,7,1527721625.0,0,gfycat.com,0,344,CuteModeSlutMode,"Cute Mode | Slut Mode, Fitness Hottie",0.97
561,77,1527693979.0,0,i.redd.it,0,1393,tennis,Venus and Serena were just a bit taller than their opponents,0.96
562,6,1527717212.0,0,i.redd.it,0,430,skyrim,Dawnguard,0.98
563,209,1527706138.0,0,marca.com,0,1157,soccer,"Casillas: ""I have had my 'Karius' moments, like the game against Holland in 2014""",0.97
564,11,1527695442.0,0,i.redd.it,0,1277,BlancNoir,Miss Noir is such a goddess.,0.95
565,40,1527715214.0,0,i.redd.it,0,483,TheSimpsons,God said to Noah there's gonna be a floody floody....,0.99
566,203,1527705845.0,0,i.redd.it,0,6136,gaming,An early look at Fallout 76,0.94
567,473,1527672979.0,0,twitter.com,0,4582,ireland,Richard Bruton: I am proposing to remove the role that religion plays in school admissions in virtually all primary schools,0.92
568,247,1527694342.0,1,imgur.com,0,1345,bicycling,When my cycling shoes wear out I cut out the solid sole and adapt a pair of dress shoes to it. Been doing it for 5 years.,0.93
569,43,1527703071.0,0,i.redd.it,0,1400,quityourbullshit,When leaving a review fucks yourself over,0.98
570,38,1527703166.0,0,youtube.com,0,849,sweden,Låt oss hoppas att allt går bra med Sveriges stolthet Simone.,0.93
571,38,1527681017.0,1,i.redd.it,0,2869,goddesses,Josephine Skriver,0.95
572,42,1527678229.0,1,i.imgur.com,0,3210,asstastic,Breakfast is ready 👅 [F],0.95
573,515,1527688044.0,1,self.personalfinance,0,1881,personalfinance,Paying off house early: key to success or stupid?,0.92
574,22,1527705872.0,1,i.redd.it,0,739,SupermodelCats,My wife took a picture of our cat Grayson in her yarn,0.98
575,145,1527678241.0,0,i.imgur.com,0,3274,antiMLM,"Damn, I have such a toxic attitude for wanting people not to get scammed by MLMs.",0.99
576,194,1527670156.0,1,i.imgur.com,0,18805,tumblr,Why I date tall people,0.96
577,29,1527702011.0,6,gfycat.com,0,1461,AnimalsBeingDerps,Cat helps finish jigsaw puzzle.,0.98
578,606,1527695448.0,1,self.reddevils,1,1253,reddevils,Tad Bit of Info that I have held back on Griezmann (per prior post of ongoing contract discussions for sleeve sponsor),0.95
579,507,1527678474.0,1,i.redd.it,0,3177,de,Österreich im a nutshell,0.95
580,59,1527705948.0,0,i.imgur.com,1,719,simracing,Whose fault is it?,0.96
581,325,1527693312.0,0,self.heroesofthestorm,0,1398,heroesofthestorm,"The next hero will be the 80th one, allowing for a full 40v40 Alterac Valley battle!",0.94
582,33,1527690620.0,0,i.redd.it,0,1588,tanlines,Track season is over,0.98
583,24,1527726122.0,0,i.redd.it,0,284,aviation,Got my Private Pilot License today,0.97
584,234,1527721373.0,1,nytimes.com,0,2105,politics,F.B.I. Official Wrote Secret Memo Fearing Trump Got a Cover Story for Comey Firing,0.98
585,31,1527703354.0,0,i.redd.it,0,817,CODZombies,When you accidentally get your side chick pregnant,0.94
586,31,1527678801.0,0,i.redd.it,0,3505,absolutelynotme_irl,Absolutelynotme_irl,0.94
587,114,1527686145.0,0,i.redd.it,0,2061,battlestations,"After some upgrades and some cable management, I'm proud to say my setup is completely how I wanted it!",0.97
588,28,1527697006.0,0,i.redd.it,0,1136,curlyhair,My hair never looks this good on wash days,0.97
589,73,1527686511.0,1,i.redd.it,0,2022,AbsoluteUnits,"Absolute unit of a roo, seriously though this bastards about 6 ft tall",0.96
590,145,1527679799.0,0,i.redd.it,0,3056,Nicegirls,Why is being difficult a good thing?,0.96
591,283,1527718849.0,0,self.GlobalOffensive,0,574,GlobalOffensive,SK Gaming vs Team Liquid / StarSeries i-League Season 5 - Round 3 / Post-Match Discussion,0.97
592,176,1527690275.0,0,i.redd.it,0,1613,smashbros,"I’ve been playing so much Falco lately, I couldn’t help but draw him. Hopefully he receives a well deserved buff in smash switch!",0.94
593,4087,1527695749.0,0,self.AskReddit,0,3360,AskReddit,What common sob stories do you have no sympathy for?,0.94
594,34,1527695849.0,0,i.redd.it,0,1186,IncrediblesMemes,IT'S BIGGER!,0.96
595,0,1527713301.0,0,i.imgur.com,0,488,Hotchickswithtattoos,Ivory,0.97
596,39,1527682555.0,0,i.imgur.com,0,2420,collegesluts,Bikini blondes,0.95
597,16,1527703110.0,0,i.redd.it,0,820,BreadStapledToTrees,Just a typical English afternoon.,0.96
598,118,1527693280.0,0,i.imgur.com,0,4212,me_irl,me irl,0.97
599,623,1527696593.0,2,self.fo76,0,1139,fo76,"A 29 December 2017 post on 4chan correctly predicted the next Bethesda game will be called ""Fallout 76"". Claimed it's going to be a ""Fallout-themed Rust clone"". Link inside.",0.95
600,29,1527705983.0,1,sciencealert.com,0,703,environment,"Director James Cameron Warns The Ocean Has Become ""The Toilet of Human Civilization""",0.98
601,17,1527710222.0,3,i.redd.it,0,896,comics,Swords LXV,0.95
602,10,1527712075.0,0,i.imgur.com,0,511,AsianHotties,Who is targeted?,0.97
603,31,1527677358.0,1,i.imgur.com,0,3194,thick,Feeling like a total babe! 💜 [OC],0.94
604,431,1527669240.0,2,i.redd.it,0,28401,hmmm,hmmm,0.94
605,11,1527711365.0,0,i.imgur.com,0,518,CatSlaps,Chopper vs. Busty,0.97
606,8,1527718986.0,0,i.redd.it,0,362,AnimalCrossing,"After a year working my first professional job and being incredibly frugal, I have finally paid off my student loans in full. You bet your bells I struck this pose when it happened.",0.98
607,68,1527706951.0,1,v.redd.it,0,3009,oddlysatisfying,Chain reaction - Rube Goldberg assembly put to excellent use,0.96
608,16,1527714154.0,1,i.imgur.com,0,735,Unexpected,Suspicious looking dog,0.96
609,566,1527678195.0,0,youtube.com,0,3495,Documentaries,"(2016) Locked In My Body - It's about a guy from Wales who got guillain barre syndrom, it affects 1 in 100 000 and you can hear, smell, feel but you cant move anything. (14:08)",0.96
610,35,1527717179.0,0,i.redd.it,0,388,assassinscreed,"Just started Origins a couple of days ago. I give you, The Winged Medjay of The Sphinx",0.96
611,10,1527705183.0,0,i.redd.it,0,719,equelMemes,Rey One,0.93
612,25,1527716170.0,0,imgur.com,0,410,ketorecipes,First attempt at Fathead Pizza,0.96
613,138,1527719626.0,0,i.redd.it,0,348,australia,"Rocked up late to work this morning, found this note stuck to the door. My name is not Oggs.",0.95
614,17,1527713606.0,0,i.redd.it,0,462,Supernatural,Dean knows best,0.95
615,11,1527719317.0,0,i.redd.it,0,361,AccidentalRenaissance,Punk Show at the Bar,0.88
616,129,1527712537.0,0,i.redd.it,0,1228,StarWars,The Smiling Women of Star Wars,0.93
617,39,1527700902.0,1,i.redd.it,0,1409,OldSchoolCool,Actress Lee Purcell in the 1960s,0.97
618,20,1527683914.0,2,i.imgur.com,0,2168,Boobies,Tessa's tits are one of the best.,0.94
619,35,1527716960.0,0,youtube.com,0,606,youtubehaiku,[Poetry] [insert Wednesday here],0.83
620,142,1527683853.0,0,i.redd.it,0,3516,wow,I'm going to miss those happy knee pads from the login screen when BFA rolls around!,0.96
621,27,1527685060.0,0,i.redd.it,0,2046,Pareidolia,"""I've seen things...""",0.92
622,42,1527692962.0,0,i.redd.it,0,1315,trailerparkboys,got stoned and decided i had to make one more of these for this greasy bastard. changed up the classes too.,0.96
623,8,1527701169.0,0,i.imgur.com,0,866,facedownassup,"[AIC] [19F] You all wanted more, so here's a small album! Let her know what ya think!",0.97
624,14,1527714844.0,0,imgur.com,0,704,GetMotivated,[Image] Malala Yousafzai's first day at Oxford,0.94
625,67,1527681992.0,0,i.redd.it,0,2395,donaldglover,This is my rendition of the Jim Crow poster with the interpretation from the awe-controversial music video. Took me 3 days to illustrate.,0.95
626,20,1527714567.0,0,i.redd.it,0,441,pelfie,Just me and my pussy,0.97
627,14,1527705869.0,0,i.redd.it,0,1069,madlads,"The $300,000 madlad",0.98
628,18,1527707075.0,0,i.imgur.com,0,1018,BetterEveryLoop,Policeman's laugh at a snowman prank (x-post /r/mademesmile),0.97
629,39,1527713592.0,0,i.redd.it,0,2954,funny,All grown up,0.95
630,220,1527682293.0,4,v.redd.it,0,4501,GamePhysics,[iRacing] Some say they’re still spinning now...,0.97
631,1565,1527661734.0,4,i.imgur.com,0,17079,JusticeServed,False report indictment,0.88
632,119,1527715608.0,0,i.redd.it,0,412,DBZDokkanBattle,The Exciting Category Meta: Visualized,0.94
633,52,1527707167.0,0,imgur.com,0,618,Watches,"[Omega] I've finally acquired the Omega AT in blue, the watch I've been drooling over for years",0.97
634,362,1527660080.0,5,i.redd.it,0,30973,yesyesyesyesno,Thanks for the support,0.9
635,32,1527688122.0,0,i.redd.it,0,1635,GirlswithGlasses,I’m thinking I should wear my glasses more often [oc],0.96
636,39,1527701623.0,0,imgur.com,0,831,Tendies,Normies appropriating our piss jugs and poopy bags reeeeeeee,0.96
637,27,1527674826.0,0,i.imgur.com,0,3574,tuckedinkitties,He only sleeps with our son. And always like this.,0.98
638,18,1527684333.0,0,i.redd.it,0,2031,Blep,Meet Buffy. She only has one tooth so always has a blep,0.99
639,19,1527697205.0,0,i.imgur.com,0,1013,FestivalSluts,Slim and Busty (xpost r/titstagram),0.96
640,190,1527685658.0,0,i.redd.it,0,34231,PrequelMemes,Don't try it!,0.93
641,42,1527706022.0,0,thumbs.gfycat.com,0,640,dauntless,"""Wonder if he's immune... Oh.""",0.95
642,39,1527712009.0,0,i.redd.it,0,483,Smite,[SKIN CONCEPT] Tomb Lord - Hades,0.96
643,34,1527698352.0,0,self.harrypotter,1,957,harrypotter,Using an old sock as a bookmark,0.93
644,32,1527724205.0,0,imgur.com,0,262,lastimages,"This is my life long puppy, Willow, and tomorrow morning I'll be saying goodbye to her after 15 years of love. I have a storm of sadness behind my eyes and my heart is aching. And even though it's the right thing to do, part of me just wants to keep my puppy with me for just a day longer.",0.97
645,27,1527686479.0,0,i.redd.it,0,1817,JonTron,Fun in Italy!,0.94
646,48,1527715344.0,0,i.imgur.com,0,2667,aww,If you're happy and you know it tap your toes.,0.97
647,65,1527685264.0,0,i.redd.it,0,2002,terriblefacebookmemes,[FRESH],0.98
648,19,1527715199.0,0,i.imgur.com,0,394,wholesomegreentext,Anon eats a mango,0.93
649,37,1527709948.0,0,i.redd.it,0,844,cursedimages,Cursed_Iguana,0.94
650,104,1527686411.0,0,i.redd.it,0,3237,4PanelCringe,I think I threw up a little,0.97
651,26,1527694868.0,0,i.redd.it,0,1121,deathgrips,As YotS releases,0.96
652,8,1527700536.0,0,i.redd.it,0,837,Rabbits,Big bunny belly,0.99
653,19,1527699684.0,0,i.redd.it,0,882,toosoon,"Mods are asleep, upvote a meme that’s too late",0.82
654,9,1527714842.0,0,i.imgur.com,0,406,hardbodies,Good Morning Gorgeous,0.96
655,39,1527687622.0,0,i.redd.it,0,2798,creepyasterisks,just thought this deserved to be here,0.97
656,42,1527703836.0,0,i.redd.it,0,714,GamersRiseUp,We live in a society 😤😤😤😫🧐💥,0.96
657,8,1527714757.0,0,gfycat.com,0,411,grool,I am so wet today :p,0.97
658,107,1527696954.0,0,imgur.com,0,997,Michigan,Detroit would make a great Gotham,0.94
659,811,1527681698.0,0,twitter.com,0,2233,MonsterHunter,"Lunastra, the Empress of Flame has come to reclaim her throne amongst the Elder Dragons.",0.95
660,84,1527699928.0,0,v.redd.it,0,852,farcry,Far cry 3 gave me a damn near heart attack!!,0.96
661,138,1527714842.0,1,v.redd.it,1,1205,Ice_Poseidon,BJORN SPEAKS HIS MIND!,0.96
662,288,1527671788.0,1,i.redd.it,0,4434,polandball,Is Jersualem of Israel capital?,0.91
663,36,1527697151.0,0,imgur.com,0,978,Aquariums,The Mudskipper finally comfy and greeting me,0.98
664,126,1527700486.0,1,gfycat.com,0,2167,interestingasfuck,One hell of a view,0.98
665,3,1527716699.0,0,i.redd.it,0,364,nocontextpics,PIC,0.97
666,40,1527683011.0,0,self.TalesFromYourServer,0,2063,TalesFromYourServer,Beehive lady and the daiquiris,0.98
667,142,1527675416.0,0,twitter.com,0,3091,esist,"Julie Davis (NY Times): ""Depressing sight at Trump rally in Nashville: young boy, probly about my son's age, pointing iPhone at me & other reporters & snapping pix while screaming FAKE NEWS! A child who will grow up believing a free & fair press is the enemy, a bad thing, to be mocked & hated""",0.96
668,29,1527696176.0,0,i.redd.it,0,1036,pitbulls,My boyfriend gets to bring her to work sometimes and his coworker sends me these 😍,0.98
669,22,1527717110.0,0,gfycat.com,0,351,yiff,Sausage please [MF] (Whygena),0.95
670,36,1527691281.0,0,i.redd.it,0,1312,AmateurRoomPorn,The evolution of my living room during our 15 month whole-house renovation project. Lawrence KS,0.96
671,18,1527695417.0,0,i.redd.it,0,1044,blackcats,My Alfie has one white whisker. Makes him a bit distinguished I think.,0.98
672,322,1527679986.0,2,self.Fantasy,0,2394,Fantasy,"George RR Martin: ‘The battle between good and evil is a legitimate theme for a Fantasy...but in real life that battle is fought chiefly in the individual human heart...In real life, the hardest aspect of the battle between good and evil is determining which is which.’",0.93
673,28,1527701658.0,1,i.redd.it,0,763,battlefield_one,"One year ago, the planets aligned for my squad",0.98
674,14,1527710767.0,0,i.redd.it,0,476,birdswitharms,Spotted on Instagram this morning,0.96
675,25,1527707484.0,0,i.redd.it,0,562,arrow,[Shitpost] No one can know his secret,0.96
676,15,1527705418.0,0,i.redd.it,0,621,ghibli,Finally made my Calcifer kitchen art with my wood burner. One of my favourite characters so I hope I did him justice.,0.97
677,49,1527702582.0,0,i.redd.it,0,723,chubby,Horny at work...(F)irst time posting here :),0.95
678,10,1527708141.0,0,i.redd.it,0,544,medievaldoctor,Medieval Europe just does that,0.96
679,93,1527695784.0,0,i.redd.it,0,1027,WWII,Call of Duty WWII in a nutshell,0.9
680,27,1527680916.0,0,i.redd.it,0,2369,ExpandDong,Is this movie any good?,0.96
681,22,1527679694.0,0,i.redd.it,0,2550,YouSeeComrade,"You see comrade, true beauty is embodied by the soviet union",0.96
