,comments,created_utc,crossposts,domain,gilded,score,subreddit,title,upvote_ratio
0,124,1527717553.0,0,i.redd.it,0,15854,BikiniBottomTwitter,About to make a splash? More like just about to crash,0.93
1,2263,1527711629.0,2,thehill.com,0,24831,politics,FBI is reconstructing shredded documents obtained during Cohen raid,0.93
2,1614,1527714888.0,3,youtube.com,3,32645,videos,"Gamer bet if the new Bethesda reveal was not Fallout 3 Remastered, he'd drink a whole bottle of Tabasco sauce - he kept his promise.",0.87
3,1047,1527711249.0,1,smh.com.au,0,26425,worldnews,"Police faked 258,000 breath tests in shocking 'breach of trust'",0.94
4,103,1527719476.0,0,i.redd.it,0,7350,PrequelMemes,"Always 2 there are, no more, no less",0.94
5,608,1527711421.0,0,i.redd.it,0,22572,gaming,One vault away from a great game,0.96
6,255,1527717511.0,1,gfycat.com,0,6645,StartledCats,Boy or Girl?,0.9
7,1838,1527708829.0,0,self.Fallout,33,40250,Fallout,I don't want to set the world on fire...,0.9
8,1600,1527709063.0,1,cnn.com,0,16660,news,Trump signs 'Right to Try Act' aimed at helping terminally ill patients seek drug treatments,0.94
9,1734,1527706189.0,14,v.redd.it,1,62037,HumansBeingBros,Coolest Bus Driver Prevents Pedestrian Accident,0.95
10,53,1527716924.0,1,i.redd.it,0,7792,memes,Couple goals.,0.97
11,1090,1527706045.0,2,floridamuseum.ufl.edu,0,47338,todayilearned,TIL You are 10 times more likely to get bitten by a New Yorker than a shark.,0.91
12,120,1527711418.0,2,i.imgur.com,0,9291,asianpeoplegifs,Magic trick with a cat,0.96
13,1047,1527708422.0,6,i.imgur.com,1,40787,gifs,8-year-old boy asked his mom to stop the car so he could help a woman up the stairs,0.85
14,1519,1527703469.0,10,i.redd.it,1,118792,aww,My landlord was replacing our sink and sent me this.,0.95
15,764,1527706146.0,1,twitter.com,0,19002,NintendoSwitch,"""Shoutouts to the god-tier troll who leaked Pokémon Let's Go on April 1st and nobody believed any of it""",0.93
16,201,1527709850.0,0,i.redd.it,0,11584,MemeEconomy,Closet fan meme.,0.95
17,281,1527707168.0,1,i.redd.it,0,20811,Art,"Study Of Water, Oil Paint, 90 x 120cm",0.92
18,258,1527706523.0,10,i.imgur.com,0,36299,funny,Pink Panther!,0.88
19,397,1527703678.0,3,i.redd.it,0,51873,wholesomememes,A wholesome exchange for mom,0.94
20,117,1527707548.0,0,i.redd.it,0,11730,WhitePeopleTwitter,Rap is romance,0.98
21,373,1527704868.0,0,i.redd.it,0,18762,AdviceAnimals,It just takes a few seconds and can really help the good ones,0.91
22,1262,1527713417.0,0,streamable.com,0,5266,nba,"LeBron James on the Warriors: ""One of the best teams i ever played.. and then they added Kevin Durant""",0.96
23,148,1527706010.0,3,i.redd.it,0,12681,ProgrammerHumor,what?,0.94
24,506,1527702887.0,1,i.redd.it,0,18793,trashy,"Came across this on instagram. If this doesn’t belong here, I quit.",0.93
25,174,1527717715.0,0,i.imgur.com,0,7742,gaming,Fallout cosplay,0.94
26,611,1527699951.0,2,i.redd.it,0,38520,BlackPeopleTwitter,Something to “lighten” the mood,0.94
27,83,1527709699.0,0,i.redd.it,0,7237,madlads,Milwaukee madlad,0.94
28,67,1527712523.0,0,i.redd.it,0,4773,wholesomebpt,Friendship goals,0.93
29,984,1527699381.0,1,i.redd.it,0,24277,insanepeoplefacebook,The dangers of over-medicating your dog,0.96
30,194,1527702500.0,0,i.imgur.com,0,10549,holdthemoan,at Work [img],0.92
31,375,1527699160.0,10,gfycat.com,0,31330,interestingasfuck,Built-in LEGO wall,0.92
32,129,1527702827.0,4,i.imgur.com,0,15040,PeopleFuckingDying,HElplESs GirL dEStRoYeD by CAteGorY 5 ToRNAdO,0.92
33,757,1527702393.0,3,self.marvelstudios,0,15209,marvelstudios,After watching Infinity war for the 9th time I realized something...,0.87
34,255,1527701356.0,0,v.redd.it,0,11575,nonononoyes,My heart was pounding,0.94
35,377,1527700175.0,0,i.redd.it,0,13683,ActLikeYouBelong,Spotted at Goodwill. Imagine the possibilities!,0.94
36,83,1527704696.0,0,i.redd.it,0,7508,ImGoingToHellForThis,Hey...these rope jokes are fun!! Dunno what she's on about,0.9
37,308,1527705005.0,0,self.IAmA,0,6524,IAmA,We're two Pulitzer finalist investigative reporters who have spent a year looking at exploitative rehabs that put residents to work for free. Ask us anything.,0.94
38,145,1527701207.0,1,i.redd.it,0,19404,dankmemes,mods are gay,0.93
39,452,1527699217.0,2,i.redd.it,0,19836,OldSchoolCool,Delta Burke in the 1970s,0.92
40,526,1527701668.0,1,i.redd.it,0,9658,4chan,Britbong brings the bants,0.89
41,1154,1527698428.0,4,v.redd.it,0,24041,WTF,"Working on a car today, found this little guy",0.86
42,1751,1527705800.0,1,self.AskReddit,3,34192,AskReddit,"People of reddit, do you think it's worth upgrading your finger guns from single barrel to double barrel? People who have done this, do you regret it? Why or why not?",0.73
43,1157,1527702808.0,1,ew.com,1,8095,television,ABC may consider putting ‘Roseanne’ costars on new show,0.89
44,31,1527708454.0,0,i.imgur.com,0,4855,shittymoviedetails,"In Spider-Man 3, Peter Parker doesn’t avoid stepping on cracks that break his mom’s back, because his mom is dead.",0.95
45,112,1527709723.0,0,self.Jokes,0,4915,Jokes,"At school one day, Little Johnny’s teacher asks the class to use the word “contagious” in a sentence…",0.95
46,34,1527714635.0,0,i.redd.it,0,3475,trebuchetmemes,The Superior Siege Weapon,0.93
47,20,1527709051.0,2,i.imgur.com,0,4555,Eyebleach,The Cat and the Magic Trick,0.98
48,661,1527695312.0,3,i.imgur.com,0,22620,blackpeoplegifs,Cop spars guy on the street,0.94
49,338,1527703992.0,0,i.redd.it,0,7831,greentext,Anons explain how hygiene is around the world,0.94
50,143,1527696132.0,4,instagram.fyyz1-1.fna.fbcdn.net,0,18257,EarthPorn,Vøringsfossen waterfall in Norway - (Janne Kahila)[1080 x 1272],0.97
51,381,1527696795.0,3,i.redd.it,0,17512,FellowKids,Surely this will do the trick!,0.95
52,162,1527701608.0,0,i.redd.it,0,8943,evilbuildings,AT&T Tower Blood Moon Rising,0.94
53,2838,1527695538.0,5,i.imgur.com,1,85911,pics,Nothing about this picture has aged well.,0.86
54,297,1527694581.0,5,v.redd.it,0,36555,oddlysatisfying,How he perfectly jumps in the hole,0.92
55,1144,1527697271.0,4,imgur.com,1,21224,LateStageCapitalism,"When boomers say ""why don't you buy a house?""",0.82
56,261,1527699979.0,0,self.CrazyIdeas,0,7649,CrazyIdeas,"Posthumously change the names of mass shooters and domestic terrorists to things like the Indiana Idiot, the California Clown #4, and the Texas Twat.",0.94
57,210,1527697644.0,2,i.imgur.com,0,10239,HistoryPorn,"Sailor and girl at the Tomb of the Unknown Soldier, Washington, D.C., May 1943 [2777x2153]",0.94
58,1238,1527696832.0,2,imgur.com,0,19250,movies,New Official 'Ralph Breaks the Internet: Wreck-It Ralph 2' Images,0.84
59,32,1527708175.0,0,imgur.com,0,4237,trippinthroughtime,My lasagna!,0.95
60,2252,1527702224.0,2,washingtonpost.com,1,27944,politics,The debate is over: Of course Trump obstructed justice,0.82
61,410,1527704922.0,0,youtu.be,0,4478,Justrolledintotheshop,Belt snapped at 2AM in route to Disney. I drove over an hour with zipties running my water pump.,0.96
62,129,1527696390.0,1,i.redd.it,0,13155,GetMotivated,[IMAGE] Be superior to yourself today.,0.95
63,5338,1527691538.0,8,alexa.com,8,97018,technology,Reddit just passed Facebook as #3 most popular website in US,0.89
64,535,1527693379.0,1,imgur.com,0,28551,food,[homemade] Chocolate birthday cake,0.92
65,117,1527715774.0,0,self.Showerthoughts,0,2841,Showerthoughts,The best part of a cucumber tastes like the worst part of a watermelon.,0.93
66,65,1527703407.0,0,gfycat.com,0,5218,AnimalsBeingJerks,"Cat ""helps"" finish jigsaw puzzle.",0.97
67,86,1527712638.0,1,v.redd.it,0,3314,assholedesign,This should be punishable by law. Truly worthy of this sub!,0.96
68,351,1527709473.0,0,imgur.com,0,3971,Ice_Poseidon,"Tariq Nasheed - Make this the first image you see when you google ""Tariq Nasheed""",0.86
69,88,1527697110.0,3,i.redd.it,0,10653,AnimalsBeingDerps,Taken at the right time,0.95
70,85,1527714248.0,0,i.redd.it,0,2580,RocketLeague,when nobody calls kickoff and nobody takes it,0.97
71,161,1527694212.0,0,i.redd.it,0,20379,me_irl,me4irl,0.92
72,1527,1527696166.0,3,theverge.com,0,12761,gadgets,Asus made a crypto-mining motherboard that supports up to 20 GPUs,0.89
73,1561,1527690840.0,1,bbc.com,2,20651,europe,'Murdered' Russia journalist Arkady Babchenko turns up alive,0.95
74,217,1527709359.0,1,self.leagueoflegends,1,3180,leagueoflegends,Aubeelion sol Splash art,0.96
75,57,1527712850.0,0,i.redd.it,0,2694,ExpectationVsReality,What you think you look like when you hit on someone vs. reality,0.9
76,897,1527709290.0,1,i.redd.it,0,32661,gaming,Hold my Nuka-Cola...,0.88
77,24,1527716800.0,0,i.redd.it,0,2209,CozyPlaces,Coffee with a view,0.98
78,1182,1527690419.0,1,youtube.com,0,28342,shittyrobots,Simone going in to brain surgery,0.89
79,466,1527701834.0,4,i.redd.it,0,11971,gifs,110lb anvil floating on liquid mercury,0.96
80,303,1527700844.0,1,i.imgur.com,0,14916,funny,Poor Jeremy,0.91
81,153,1527697892.0,2,imgur.com,0,6695,gameofthrones,"[Spoilers] My painting of the week- ""The Real Bastard""",0.91
82,790,1527692122.0,15,v.redd.it,0,19677,Whatcouldgowrong,"Not slowing down at a speed bump, wcgw?",0.91
83,353,1527692096.0,5,v.redd.it,0,26095,FortNiteBR,"Made a ramp to clear a gap with the shopping cart, some random stranger decided to get in on the hype with me!",0.92
84,296,1527692712.0,4,i.imgur.com,0,12733,mechanical_gifs,Such a simple mechanism but big time saver,0.92
85,314,1527693963.0,0,mail.com,0,11039,UpliftingNews,Domestic violence shelter being custom-built to include pets,0.94
86,48,1527707515.0,2,v.redd.it,0,3657,AnimalsBeingBros,The best ring bearer,0.97
87,261,1527701698.0,0,i.redd.it,0,4913,thatHappened,LMAO EPIC!!!!!,0.95
88,182,1527703799.0,0,self.MaliciousCompliance,0,4127,MaliciousCompliance,"She not only lost her job, the whole store was shut down.",0.94
89,535,1527690795.0,1,i.redd.it,0,17847,MurderedByWords,In response to Roseanne’s use of Ambien,0.91
90,653,1527693208.0,2,youtube.com,0,9795,space,"Dr. Robert Zubrin with a brilliant answer to ""Why Should We Go To Mars?""",0.94
91,45,1527715702.0,0,np.reddit.com,0,2148,bestof,/u/Flake_of_Snow posts about not being able to get rid of a couple of tons of sand/gravel mix. /u/J_Weatherman wishes he was close by because that's exactly what he needs. Turns out they live half an hour away from each other.,0.95
92,22,1527721258.0,0,i.redd.it,0,1586,BoJackHorseman,I wonder if these two ever found each other,0.97
93,311,1527690023.0,1,i.imgur.com,0,15807,AbandonedPorn,"Abandoned apartment building being claimed by the sea in the former fishing village of Kirovsky, Russia. [2048 × 1536]",0.96
94,237,1527689780.0,1,i.redd.it,0,21582,DunderMifflin,When a coworker asks you if you were slacking because you were in the bathroom for a half hour,0.95
95,32,1527702306.0,0,gfycat.com,0,4259,BiggerThanYouThought,nice,0.94
96,132,1527705950.0,1,i.redd.it,0,3590,tumblr,the truth of life with MAN CAN,0.97
97,399,1527701380.0,1,v.redd.it,0,12765,aww,My brother came home from the navy and surprised my mom at work.,0.91
98,242,1527690243.0,0,i.redd.it,0,17391,ShittyLifeProTips,Your girlfriend pissing you off?,0.95
99,258,1527688626.0,3,i.imgur.com,0,26215,NatureIsFuckingLit,🔥 Lava looking like melted plastic 🔥,0.94
100,932,1527687944.0,5,i.redd.it,0,46956,CrappyDesign,Class stalls in bathroom. ....,0.92
101,39,1527695588.0,1,i.redd.it,0,8324,dankchristianmemes,Alright 🅱uddy end of the line,0.92
102,66,1527695057.0,1,i.redd.it,0,8213,disneyvacation,How To Borrow A Napkin,0.97
103,499,1527689464.0,12,i.redd.it,0,26004,WhatsWrongWithYourDog,Where's my food?,0.88
104,46,1527707764.0,0,i.redd.it,0,5895,PrequelMemes,[Visible confusion],0.98
105,218,1527700730.0,0,i.imgur.com,0,4805,dataisbeautiful,Every Road in the Continental US [OC],0.95
106,432,1527702842.0,2,i.redd.it,0,6898,WTF,I dont have an xray but heres my broken arm from 5th grade.,0.94
107,129,1527691967.0,0,i.redd.it,0,9812,Awwducational,"Manatee calves are around 60-70 lbs at birth and about 3-4 feet long. They will stay with the mother for 1-2 years. During that time the mother will teach them how to find food, warm water, travel corridors and how to avoid boats.",0.96
108,952,1527698103.0,0,i.redd.it,0,5852,h3h3productions,Ethan's Plan,0.84
109,70,1527693917.0,5,i.imgur.com,0,8661,DiWHY,36 foot Yacht,0.89
110,1995,1527690983.0,1,usatoday.com,0,37748,nottheonion,Ambien-maker to Roseanne: Racism is not a side effect of our drug,0.77
111,256,1527703519.0,0,imgur.com,0,3391,pcmasterrace,Finally getting to show her off at the company LAN party,0.95
112,55,1527708685.0,0,v.redd.it,0,2537,SweatyPalms,See Saw.....My heart is pounding,0.94
113,521,1527687477.0,0,i.imgur.com,0,32032,fakehistoryporn,Unidentified man refuses to stand for nazi salute (1941),0.92
114,332,1527687295.0,5,i.redd.it,0,23131,woahdude,Night and day,0.89
115,74,1527688080.0,0,i.imgur.com,0,13963,KenM,Ken M explains the deception of clay,0.95
116,189,1527690113.0,2,gfycat.com,0,11945,INEEEEDIT,Mini rice ball maker,0.89
117,241,1527700945.0,0,unikrn.com,0,3832,GlobalOffensive,"Russia's Minister of Sport: ""It does not matter whether the government or somebody else recognizes esports as a sport. It was recognized by the society. By people who are making it. Our task is to regulate it.""",0.95
118,432,1527685193.0,0,mormonleaks.io,0,13985,atheism,"MormonLeaks has uncovered 13 LLC's (limited liability company) that appear to be owned by the Mormon Church. Combined, the companies are worth over 32 BILLION dollars. The Mormon Church has 32 billion in the stock market. If you've ever wanted proof that religion is just a business, this is it.",0.95
119,117,1527697179.0,9,gfycat.com,0,4847,CatastrophicFailure,A bridge collapses because of heavy rains in Cuba,0.97
120,92,1527713717.0,0,i.redd.it,0,1880,Wellthatsucks,My dad just took this from his front porch in hawaii. Lava heading straight for my home.,0.98
121,90,1527703475.0,1,i.imgur.com,0,3387,Damnthatsinteresting,Anvil floating in mercury,0.98
122,71,1527705035.0,0,twitter.com,0,2754,BlueMidterm2018,Topher Spiro on Twitter: BREAKING: The Virginia Senate just voted to expand Medicaid. Virginia will be the 34th state (including DC) to expand Medicaid. This is a major victory that will transform the lives of hundreds of thousands of families.,0.94
123,40,1527714145.0,0,i.redditmedia.com,0,1703,Naruto,Kendrick Lamar traps his audience in the Infinite Tsukuyomi,0.96
124,255,1527697662.0,1,imgur.com,0,4277,specializedtools,"5.25"" floppy disc notch cutter - used to turn single sided discs into double sided",0.97
125,82,1527687123.0,7,i.redd.it,0,14806,BeAmazed,Underwater Buddha ruins in Nusa Lembongan (small island near Bali).,0.97
126,29,1527705914.0,0,i.redd.it,0,2734,indianpeoplefacebook,How to take compliments 101,0.97
127,655,1527685395.0,2,i.imgur.com,0,30194,Unexpected,Relaxing in the sun.,0.89
128,55,1527706937.0,0,i.redd.it,0,4061,BlackPeopleTwitter,Dad is that you,0.97
129,126,1527709478.0,1,i.imgur.com,0,2156,WatchandLearn,A UV camera directly shows how sunscreen absorbs UV light on your body,0.95
130,66,1527686795.0,5,i.redd.it,0,17342,thisismylifenow,What goes in doesn’t always come out,0.88
131,96,1527698797.0,1,i.redd.it,0,4181,gardening,Beautiful poppies that just bloomed in my garden,0.97
132,20,1527709186.0,0,gfycat.com,0,2082,palegirls,She looks like she knows what she’s doing,0.95
133,48,1527696649.0,1,imgur.com,0,5013,misleadingthumbnails,Chris Pratt with his ISIS flag,0.9
134,1205,1527686147.0,1,self.pokemon,0,10596,pokemon,Gamefreak confirm the 2019 Switch games will not be influenced by Pokemon Go,0.96
135,282,1527712432.0,1,clips.twitch.tv,0,1752,LivestreamFail,Mcconnell on Bless Online,0.92
136,61,1527695306.0,2,gfycat.com,0,4955,tippytaps,Flamingo,0.98
137,270,1527687849.0,3,i.redd.it,0,11056,PoliticalHumor,In her defence,0.89
138,47,1527704774.0,0,i.redd.it,0,2876,EmpireDidNothingWrong,"Once my son sees that even Lord Vader goes to bed, bedtime won’t be such a battle anymore.",0.97
139,141,1527694152.0,0,self.WritingPrompts,0,6118,WritingPrompts,"[WP] Turns out Humans are tiny compared to any other species of aliens, allowing them to live off in the nooks and crannies of alien spaceships. Colonies can live on ships for generations unseen and unknown, or have a mutually beneficial relationship with a crew.",0.96
140,66,1527690009.0,4,gfycat.com,0,6908,BustyPetite,Beautiful,0.94
141,1121,1527690089.0,4,uk.reuters.com,1,59442,todayilearned,"TIL in South Korea, only visually impaired people can be licensed masseurs, dating back over 100 years to a Japanese colonial rule set up to guarantee the blind a livelihood.",0.94
142,181,1527696213.0,0,green-flower.com,0,4130,trees,Legal cannabis is projected to pump $80 billion into U.S. economy by 2022,0.98
143,751,1527703691.0,0,thinkprogress.org,0,8682,politics,Trump melts down after reports of Sessions being key witness in Mueller’s investigation,0.95
144,680,1527694483.0,0,i.imgur.com,0,14143,pics,"""It's complicated""",0.88
145,8,1527702941.0,0,i.redd.it,0,3024,NotKenM,Not KenM on spelling,0.96
146,561,1527695539.0,0,imgur.com,0,4419,PUBATTLEGROUNDS,Server Tick rate was increased to 60 Hz with Update 14!,0.95
147,19,1527709144.0,0,i.redd.it,0,2198,surrealmemes,H⃣ O⃣ O⃣ P⃣ S⃣,0.98
148,50,1527690223.0,0,i.imgur.com,0,8071,WatchPeopleDieInside,He was never the same again.,0.95
149,46,1527713486.0,1,i.imgur.com,0,2602,movies,A fight scene between shape-shifting beings in Lotte Reiniger’s 'The Adventures of Prince Achmed' (1926). The oldest surviving animated feature film.,0.97
150,81,1527698837.0,1,i.redd.it,0,3989,rupaulsdragrace,Can we please vote for the true Miss Congeniality of season 10,0.89
151,662,1527691029.0,1,self.TwoXChromosomes,1,7839,TwoXChromosomes,"Today is our termination for medical reasons for anencephaly at the abrt clinic, I need some strength as we’re broken. Other states even try restricting emergency care where mother’s life is in danger and don’t perform terminations. It’s so appalling, sick. Being a woman in America is often unsafe.",0.82
152,6,1527712306.0,0,i.redd.it,0,1699,woof_irl,woof_irl,0.98
153,47,1527713715.0,0,i.redd.it,0,1579,Idubbbz,Best couple,0.94
154,1232,1527690739.0,1,bbc.co.uk,0,16714,worldnews,"Russian journalist Arkady Babchenko, reportedly assassinated in Kiev on Tuesday, appears on TV alive and well",0.95
155,1345,1527711027.0,1,bleacherreport.com,0,2768,nba,[BR] Klay Thompson on 4th Warriors-Cavs Finals: 'Rest of the NBA Has to Get Better',0.93
156,9858,1527697301.0,2,self.AskReddit,0,13580,AskReddit,What’s the sluttiest thing you’ve ever done?,0.81
157,243,1527685039.0,3,i.redd.it,0,12475,lego,My lego city theme park display inspired by DISNEYLAND called Disney Down Under! ENJOY! :),0.93
158,74,1527698937.0,2,i.imgur.com,0,8660,oddlysatisfying,This pine tree dropping,0.94
159,168,1527685237.0,1,i.redd.it,0,16828,boottoobig,"Roses are Red, You drink from a cup",0.91
160,69,1527697412.0,0,i.redd.it,0,3671,westworld,Friday Night vs Monday Morning,0.95
161,8,1527701706.0,0,i.redd.it,0,3108,bonehurtingjuice,oof ouch my window,0.97
162,181,1527695781.0,0,i.imgur.com,0,4245,nostalgia,Car door ashtrays,0.95
163,1399,1527683487.0,3,i.imgur.com,0,37683,facepalm,Call me cynical... but i don't believe that you do that.,0.87
164,1037,1527689585.0,0,self.UnethicalLifeProTips,0,15746,UnethicalLifeProTips,ULPT: Sick of seeing FOX news on all the time at your parents'/grandparents' house? Block the channel with the parental controls. It could take them quite a while to figure out how to unblock it.,0.77
165,70,1527696426.0,0,i.redd.it,0,4304,totallynotrobots,MY DAD AT WORK,0.95
166,73,1527693646.0,2,youtu.be,0,4625,youtubehaiku,[Haiku] Avatar the Last Chairbender,0.95
167,559,1527690919.0,0,i.redd.it,0,13813,Gamingcirclejerk,Can we get 76 upboats for our brave developers not featuring women in our reveal trailer?,0.75
168,51,1527707951.0,0,i.redd.it,0,2059,justneckbeardthings,It pays to not be a neckbeard,0.95
169,68,1527707842.0,0,i.redd.it,0,4287,dankmemes,Marijuana... not even once,0.96
170,354,1527700003.0,0,self.Fallout,1,5426,Fallout,"RIP my inbox. 1322 messages. To sate the horde, I will be buying a NEW UNOPENED bottle. Please hold.",0.96
171,740,1527683997.0,5,i.redd.it,0,80501,mildlyinteresting,This piano I made out of random rocks,0.85
172,193,1527692865.0,0,cnn.com,0,4562,The_Mueller,Devin Nunes: The FBI spied on Trump! FBI: Here's what actually happened. Devin Nunes: … (5 days of silence),0.91
173,297,1527686266.0,0,i.redd.it,0,8787,therewasanattempt,An instagram 'model' with 3000 followers tried to get free stuff from a club with 30k likes,0.97
174,52,1527710432.0,0,i.imgur.com,0,1700,WeatherGifs,"""What beautiful weather we're hav-""",0.96
175,526,1527680864.0,11,v.redd.it,0,31748,holdmybeer,HMB while I slide across this puddle barefoot,0.93
176,78,1527684872.0,0,imgur.com,0,10563,oldpeoplefacebook,"Oh Toni, you're going to miss out!",0.96
177,185,1527688462.0,0,i.redd.it,0,7608,lotr,"After 300+hours of 3d printing, acetone welding, painting and padding out, my crown is complete. Now to rule this subreddit.",0.94
178,104,1527684260.0,1,i.redd.it,0,16256,HistoryMemes,Is this meme dead yet?,0.92
179,285,1527689630.0,2,v.redd.it,1,6304,thalassophobia,Ever had that sinking feeling .......?,0.97
180,51,1527694964.0,0,i.redd.it,0,4005,raining,Working in the print shop with the garage door open while it downpours is pretty much my idea of heaven. This spring has been awesome in Lake Tahoe.,0.97
181,68,1527711795.0,0,self.Competitiveoverwatch,1,1535,Competitiveoverwatch,"Don't upvote, stupid question",0.87
182,218,1527687992.0,0,imgur.com,0,8814,Bossfight,"Unitus Absolutus, Elite Royal Guard of the Queen.",0.94
183,98,1527693478.0,0,i.redd.it,0,4470,MovieDetails,"In Civil War, you can see Tony's scar from his first arc reactor",0.95
184,402,1527683431.0,9,gfycat.com,0,16613,nononono,Doing a backflip over a girl,0.88
185,1200,1527680082.0,8,i.imgur.com,0,31452,natureismetal,Bees rescuing one of their comrades when it gets injured in battle.,0.94
186,62,1527705542.0,0,i.redd.it,0,2191,IdiotsInCars,"Excuse me, sir.",0.98
187,215,1527684192.0,1,i.imgur.com,0,11220,anime_irl,anime irl,0.92
188,535,1527690222.0,0,streamable.com,0,5115,soccer,"Thomas Müller : "" I looked back in my family and my grandfather had a dog that watched brazilian tv, so I am half brazilian.""",0.95
189,32,1527712148.0,1,i.redd.it,0,1548,crappyoffbrands,Just yelp for help,0.98
190,74,1527686974.0,1,i.redd.it,0,14489,DeepFriedMemes,He would've 🅱️eaten 🅱️hanos,0.92
191,58,1527704214.0,2,i.redd.it,0,2325,Animemes,I hope this hasn't been done before,0.97
192,96,1527697750.0,0,self.ProRevenge,0,3233,ProRevenge,"We've all had bad bosses before, right?",0.95
193,423,1527693862.0,1,self.tifu,0,4948,tifu,TIFU by Giving my Daughter a Golden Shower,0.93
194,54,1527692157.0,0,i.redd.it,0,4551,arresteddevelopment,Seen in NYC subway car ... thought it was a real fashion ad at first,0.97
195,450,1527699835.0,1,i.redd.it,0,12257,funny,Popcorn+Coke= 3x the ticket in my country,0.92
196,16,1527708998.0,0,i.redd.it,0,1720,TheLastAirbender,That or a deadly poison...,0.95
197,39,1527689101.0,1,i.redd.it,0,6534,nevertellmetheodds,That’s (un)real!,0.96
198,231,1527690217.0,0,v.redd.it,0,12663,PewdiepieSubmissions,Can this become the new Meme Review intro?,0.85
199,41,1527686145.0,2,i.redd.it,0,7266,hardcoreaww,"Kids, that's how you do it",0.97
200,134,1527681766.0,0,imgur.com,0,13399,standupshots,Roll a deception check,0.89
201,363,1527705806.0,0,imgur.com,0,1889,Libertarian,"Ron Paul Suggests A Better Solution Than Trump's Border Wall: ""Remove the welfare magnet that attracts so many to cross the border illegally, stop the 25 year US war in the Middle East, and end the drug war that incentivizes smugglers to cross the border.""",0.89
202,85,1527688946.0,0,v.redd.it,0,5935,Zoomies,First house with a yard Zoomies,0.98
203,64,1527703905.0,0,imgur.com,0,2137,streetwear,[INSPO] Capturing people coming home from work,0.95
204,88,1527705796.0,0,i.redd.it,0,1895,MensRights,The naked truth about most media's dishonest double standards,0.89
205,363,1527679524.0,2,i.imgur.com,0,22102,RealGirls,Wearing nothing but my tan ☀️,0.89
206,111,1527694542.0,1,v.redd.it,0,4319,Rainbow6,The cleanest thing I've done to date,0.97
207,712,1527691196.0,1,youtu.be,0,24553,videos,Update on Simone. The robotics girl with cancer. Going into brain surgery. STAY STRONG SIMONE!,0.78
208,34,1527701185.0,0,i.redd.it,0,4364,me_irl,me🐻irl,0.98
209,77,1527709739.0,0,i.redd.it,0,1530,Bitcoin,We are just waiting for the good times now,0.93
210,134,1527680491.0,0,i.imgur.com,0,18941,reactiongifs,When your post gets 5 upvotes,0.89
211,373,1527683179.0,0,i.imgur.com,0,15405,creepy,heart or head,0.87
212,513,1527681684.0,0,self.askscience,0,12054,askscience,"Why is it that when you feel mildly sick from dehydration, within merely the time it takes to drink water, you almost instantly feel better? Is it a psychosomatic case, or is the body that effective at taking in water?",0.93
213,80,1527695084.0,0,twitter.com,0,3327,TrumpCriticizesTrump,"Crooked Hillary Clinton has not held a news conference in more than 7 months. Her record is so bad she is unable to answer tough questions! - June 6, 2016",0.94
214,163,1527694848.0,0,gfycat.com,0,3649,Overwatch,A casual stroll from spawn to win the game and rank up to Gold for the first time in my first real competitive Overwatch season.,0.97
215,253,1527690587.0,0,i.redd.it,0,4510,Trumpgret,Seeing Ann Coulter upset brings me joy.,0.92
216,130,1527705780.0,0,imgur.com,0,1850,hearthstone,Once upon a time this was a rank 25 play.,0.95
217,96,1527703086.0,1,gfycat.com,0,4243,FortNiteBR,Jumping the Bridge,0.97
218,626,1527679452.0,1,i.redd.it,0,26182,mildlyinfuriating,Got my glasses today.. thanks UPS,0.92
219,41,1527709965.0,0,i.redd.it,0,1477,blunderyears,Thank you Dad for telling me I shouldn't use this as my senior picture,0.99
